nct_id,brief_title,eligible,country,city
NCT06689917,JY231(JY231) Injection for the Treatment of Relapsed or Refractory B Cell Lymphoma/ Leukemia,no,China,Wuhan
NCT04186520,CAR-20/19-T Cells in Patients With Relapsed Refractory B Cell Malignancies,no,United States,Milwaukee
NCT06994169,Glofitamab in Real Life,no,France,Dunkirk
NCT07153068,SupCD7 CART for Relapsed or Refractory CD7 Positive Hematologic Malignancies,no,China,Tianjin
NCT06326008,"Safety, Tolerability, and Pharmacokinetics of Donor-derived CD19 CAR Therapy Bridged Allo-HSCT and Sequential Donor-derived CD22 CAR Therapy for r/r B-ALL: a Clinical Trial",no,China,Beijing
NCT04792489,DALY II USA/ MB-CART2019.1 for DLBCL,no,United States,Chicago
NCT07390071,Multimodal Telerehabilitation in Patients Undergoing CAR-T Cell Immunotherapy,no,United States,Salt Lake City
NCT06365671,CAR-T Following ASCT for Relapsed/Refractory B-Cell Non-Hodgkin's Lymphoma (R/R B-NHL) With High-Risk Prognostic Factors,yes,China,Shanghai
NCT06120166,Safety and Efficacy of Metabolically Armed CD19 CAR-T Cells (Meta10-19) in the Treatment of r/r DLBCL Clinical Research,no,China,Hangzhou
NCT07472972,Dynamic Individualized Risk Profiling of Patients With Relapsed/Refractory Lymphoid Malignancies and CD19-CAR T Cell Therapy (INTeRCePT 2.0),no,Switzerland,Zurich
NCT03765177,CLIC-1901 for the Treatment of Patients With Relapsed/Refractory CD19 Positive Hematologic Malignancies,yes,Canada,Vancouver
NCT07059741,Integrated Radiotherapy-optimized ASCT Sequential CAR-T Therapy for Patients With Relapsed and Refractory B-NHL,yes,China,Suzhou
NCT06834529,CAR2219 CAR-T Cells for the Treatment of R/R B Cell Leukemia and Lymphoma,no,China,Beijing
NCT07508605,Efficacy and Safety of CD19/CD20 CAR/TRuC-T in Relapsed/Refractory B-Cell Lymphoma,no,China,Shenzhen
NCT05631886,Combination of CAR-DC Vaccine and ICIs in Malignant Tumors,no,China,Beijing
NCT06500273,Consolidation of First-Line MRD+ Remission With Cema-cel in Patients With LBCL,no,Australia,Hobart
NCT06014073,TRAC and Power3 (SPPL3) Genes Knock-out Allogeneic CD19-targeting CAR-T Cell Therapy in r/r B-NHL,no,China,Beijing
NCT06414148,MRD-Directed Consolidation With Epcor-only or Epcor-R2 Post Anti-CD19 CAR TCell Therapy for Large B-Cell Lymphoma,no,Australia,Murdoch
NCT06967038,Chimeric Antigen Receptor Natural Killer Cell Therapy for High-risk Lymphoma Patients With Primary Sjogren's Syndrome,no,China,Shanghai
NCT06180174,Clinical Research of CD19 Targeted CAR-T Cell in Relapsed/Refractory B Cell Lymphoma,yes,China,Beijing
NCT05643742,A Safety and Efficacy Study Evaluating CTX112 in Subjects With Relapsed or Refractory B-Cell Malignancies,no,Australia,Nedlands
NCT07260812,KSV01 Injection for the Treatment of Relapsed/Refractory Diffuse Large B-Cell Lymphoma,yes,China,Wuhan
NCT06090864,ATLCAR.CD30.CCR4 for CD30+ HL ATLCAR.CD30.CCR4 Cells,yes,United States,Chapel Hill
NCT06494371,A Study of LCAR-HL30 in Subjects With Relapsed/Refractory Hodgkin's Lymphoma and Anaplastic Large Cell Lymphoma,yes,China,Shanghai
NCT07042438,Fecal Microbiome Transplant to Remodel Intestinal Microbiota for Patients With Relapsed or Refractory Lymphoma With Exposure to High-Risk Antibiotics Who Are Receiving Chimeric Antigen Receptor T Cells,no,United States,Duarte
NCT06213636,Fourth-gen CAR T Cells Targeting CD19/CD22 for Highly Resistant B-cell Lymphoma/Leukemia (PMBCL/CNS-BCL).,yes,China,Beijing
NCT06793241,Donor Derived CD19 CAR-T Cells in the Treatment of R/R B-cell Acute Lymphoblastic Leukemia,no,China,Hangzhou
NCT06481241,Efficacy and Safety of Chemotherapy Combined With CAR-T Cells in Newly Diagnosed Adult Patients With Ph- B-ALL,no,China,Tianjin
NCT06709469,"Phase I Clinical Trial of CART Cell Therapy for Refractory/Relapsed Acute Lymphoblastic Leukemia in Children, Adolescents and Young Adults",no,Spain,Madrid
